page_ptr_id,date,intro,body,author_id
8,2022-09-13,The way to the future..,"<p data-block-key=""8czxg"">Lorem ipsum.Lorem ipsum.Lorem ipsum.Lorem ipsum.Lorem ipsum.Lorem ipsum.Lorem ipsum.Lorem ipsum.Lorem ipsum.Lorem ipsum.Lorem ipsum.Lorem ipsum.Lorem ipsum.Lorem ipsum.Lorem ipsum.Lorem ipsum.Lorem ipsum.Lorem ipsum.Lorem ipsum.Lorem ipsum.</p>",1
9,2022-09-13,The new and fast supercar..,"<p data-block-key=""h1ns5"">Lorem ipsum.Lorem ipsum.Lorem ipsum.Lorem ipsum.Lorem ipsum.Lorem ipsum.Lorem ipsum.Lorem ipsum.Lorem ipsum.Lorem ipsum.Lorem ipsum.Lorem ipsum.Lorem ipsum.Lorem ipsum.Lorem ipsum.Lorem ipsum.Lorem ipsum.Lorem ipsum.Lorem ipsum.Lorem ipsum.Lorem ipsum.</p>",1
10,2022-09-13,This electric car is the future of motoring,"<p data-block-key=""16w7e"">Lorem ipsum.Lorem ipsum.Lorem ipsum.Lorem ipsum.Lorem ipsum.Lorem ipsum.Lorem ipsum.Lorem ipsum.Lorem ipsum.Lorem ipsum.Lorem ipsum.vLorem ipsum.Lorem ipsum.Lorem ipsum.Lorem ipsum.vLorem ipsum.Lorem ipsum.Lorem ipsum.Lorem ipsum.Lorem ipsum.Lorem ipsum.Lorem ipsum.Lorem ipsum.</p>",2
11,2022-09-13,My fantastic new shoes..,"<p data-block-key=""gqfpv"">Lorem ipsum.Lorem ipsum.Lorem ipsum.Lorem ipsum.Lorem ipsum.Lorem ipsum.Lorem ipsum.Lorem ipsum.Lorem ipsum.vLorem ipsum.Lorem ipsum.Lorem ipsum.Lorem ipsum.Lorem ipsum.Lorem ipsum.Lorem ipsum.Lorem ipsum.Lorem ipsum.Lorem ipsum.Lorem ipsum.</p>",2
12,2022-09-13,"Music is life, life is music..","<p data-block-key=""qvqp0"">Lorem ipsum.Lorem ipsum.Lorem ipsum.Lorem ipsum.Lorem ipsum.Lorem ipsum.Lorem ipsum.Lorem ipsum.Lorem ipsum.Lorem ipsum.Lorem ipsum.Lorem ipsum.Lorem ipsum.Lorem ipsum.Lorem ipsum.Lorem ipsum.vLorem ipsum.Lorem ipsum.Lorem ipsum.Lorem ipsum.Lorem ipsum.</p>",2
